,title,author,published_date,published_date_precision,link,clean_url,excerpt,summary,rights,rank,topic,country,language,authors,media,is_opinion,twitter_account,_score,_id
0,The Effects of Crude Oil Price Surprises on National Income: Evidence from India,Chinnadurai Kathiravan,2023-01-20 00:00:00,date,https://www.mdpi.com/1996-1073/16/3/1148,mdpi.com,The goal of this study is to look into how changes in crude oil prices affect GDP per capita and exchange rate fluctuations.to investigate the influence of crude oil price shocks on GDP per capita and…,"This is an early access version, the complete PDF, HTML, and XML versions will be available soon.

 

 VIT Business School, Vellore Institute of Technology, Vellore 632014, India

 Department of Commerce and Financial Studies, Bharathidasan University, Tiruchirappalli 620024, India

 Department of General Business and Finance, Sam Houston State University, Huntsville, TX 77340, USA

 Faculty of Management, Dalhousie University, Halifax, NS B3H 4R2, Canada

 Bharathidasan School of Management, Bharathidasan University, Tiruchirappalli 620024, India

 Author to whom correspondence should be addressed. 




Energies 2023, 16(3), 1148; https://doi.org/10.3390/en16031148 (registering DOI)


Received: 16 November 2022
/
Revised: 6 January 2023
/
Accepted: 9 January 2023
/
Published: 20 January 2023




Download
 Versions Notes

 
 
The goal of this study is to look into how changes in crude oil prices affect GDP per capita and exchange rate fluctuations.to investigate the influence of crude oil price shocks on GDP per capita and exchange rate movements. This research employed yearly time series data for the price of crude oil, exchange rate (USD/INR), and GDP per capita, from 1990 to 2020. Arithmetical tools such as Descriptive, Unit Root, Granger Causality Test, and OLS Model were applied. The present study discovered a strong bi-directional Granger causality effect of Dubai crude oil prices on exchange rates, as well as a bi-directional Granger influence of exchange rates on WTI crude oil prices. The diagnostic tests were successfully passed by the estimated models. According to the OLS model, the exchange rate was driven only by the price of Dubai crude oil, although the price of WTI crude oil influenced both the GDP per capita and the exchange rate over the research period. The key policy recommendation derived from this analysis is that the Reserve Bank of India (RBI) must depreciate the rupee, first to restore much-needed exchange rate stability, then to stimulate domestic manufacturers, and finally, to attract foreign capital inflows.
 

 
Kathiravan, C.; Selvam, M.; Maniam, B.; Dana, L.P.; Babu, M. The Effects of Crude Oil Price Surprises on National Income: Evidence from India. Energies 2023, 16, 1148.
https://doi.org/10.3390/en16031148


AMA Style

Kathiravan C, Selvam M, Maniam B, Dana LP, Babu M. The Effects of Crude Oil Price Surprises on National Income: Evidence from India. Energies. 2023; 16(3):1148.
https://doi.org/10.3390/en16031148

Chicago/Turabian Style

Kathiravan, Chinnadurai, Murugesan Selvam, Balasundram Maniam, Leo Paul Dana, and Manivannan Babu. 2023. ""The Effects of Crude Oil Price Surprises on National Income: Evidence from India"" Energies 16, no. 3: 1148.
https://doi.org/10.3390/en16031148",Creative Commons Attribution (CC-BY),449,science,CH,en,"Babu,Balasundram Maniam,Chinnadurai Kathiravan,Dana,Kathiravan,Leo Paul,Leo Paul Dana,Maniam,Murugesan Selvam,Selvam",https://pub.mdpi-res.com/img/journals/energies-logo-social.png?8600e93ff98dbf14,False,@MDPIOpenAccess,18.353657,a7903ce39272c42566ead40674b5e420
1,Effects of Crude Oil Price Shocks on Stock Markets and Currency Exchange Rates in the Context of Russia-Ukraine Conflict: Evidence from G7 Countries,Bhaskar Bagchi,2023-01-23 00:00:00,date,https://www.mdpi.com/1911-8074/16/2/64,mdpi.com,The present study examines the effects of the steep surge in crude oil prices which has also been considered as an oil price shock on the stock price returns and currency exchange rates of G7…,"Externally hosted supplementary file 1
Doi: 10.5281/zenodo.7357253
Description: Front Matter:
Effects of Crude Oil Price Shocks on Stock Markets and Currency Exchange Rates in the Context of Russia-Ukraine Conflict: Evidence from G7 Countries
Submitted By:
Dr. Bhaskar Bagchi
Professor of Commerce
University of Gour Banga
West Bengal, India
E-mail: [email protected]
Dr. Biswajit Paul (Corresponding Author)
Assistant Professor of Commerce
University of Gour Banga
West Bengal, India
E-mail: [email protected]
Abstract
The present paper examine the effects of the steep surge in crude oil prices which is also regarded as oil price shocks on stock price returns and currency exchange rates of the G7 countries namely, Canada, France, Germany, Italy, Japan, the United Kingdom (UK) and the United States (US) in the context of Russia - Ukraine conflict in recent times. The steep surge in Brent crude oil price returns due to the outbreak of the war is taken as an exogenous shock to stock price returns and exchange rates for the period commencing from January 2, 2017, to June 29, 2022. The paper applies the Fractionally Integrated GARCH (FIGARCH) model to capture the effect of crude oil price shock and Breakpoint unit root test to examine the structural breaks in the dataset. Structural breakpoints in the dataset for the entire stock price returns and exchange rates are observed during the period commencing from the last week of February, 2022 to the last week of March, 2022. Except for TSX, NASDAQ and USD, a noteworthy long memory effects running from Brent crude oil price to all the stock price returns along with the currency exchange rates for all G7 countries are also found.
Originality/value:
The present study investigates the effects of the Brent crude oil price shocks (due to steep increase in price) that have aroused due to the Russia – Ukraine conflict on stock price returns and currency exchange rates of G7 countries namely, Canada, France, Germany, Italy, Japan, the United Kingdom (UK) and the United States (US). The study employs the Fractionally Integrated GARCH (FIGARCH) model which is considered to be a more flexible class of process for conditional variance and is capable to elucidate and represent the detected time-based dependencies of the financial market volatility in an improved approach rather than other GARCH class of models (Davidson, 2004). Moreover, the special characteristic of the long memory nature of FIGARCH models makes it superior to other conditional heteroscedastic models and thus branding it a loftier candidate for modeling volatility in stock market returns and exchange rates (Tayefi and Ramanathan, 2012).
Key Words: G7 Countries; Crude Oil Price; Stock Return; FIGARCH.
JEL Codes: C32, C58, F51, Q34, Q43.
Back Matter:
Declarations
1.	Supplementary Materials
Tables and Figures which are to be considered as supplementary materials for this manuscript are included in the body of the main manuscript.
2.	Funding
The authors declare that there are no funding sources for the study and the authors did not receive any funding from any sources in order to complete this study.
3.	Acknowledgements
Authors would like to acknowledge Dr. Biswajit Das, University Librarian, University of Gour Banga, West Bengal India for his support and cooperation in using different software and study materials. Authors are also grateful to Raktim Ghosh, Research Scholar, Dept. of Commerce, University of Gour Banga, India for his sincere cooperation in collection and compilation of data including use of software.
4. Authors' Contribution
Conceptualization, B.B. and B.P.; Methodology, B.B. and B.P.; Software, B.B. and B.P.; Validation, B.B. and B.P.; Formal Analysis, B.B and B.P..; Investigation, B.B. and B.P.; Resources, B.B. and B.P.; Data Curation, B.B. and B.P.; Writing – Original Draft Preparation, B.B.; Writing – Review & Editing, B.P.; Visualization, B.P.; Supervision, B.B.
5.	Availability of data and materials
We have used data to support the results of the findings in our study which is included in section 4, analysis and findings of the manuscript. The datasets used and/or analysed during the current study are available from the corresponding author on reasonable request. The data presented in this study are openly available in Federal Reserve Economic Data (https://fred.stlouisfed.org/), Trading Economics (https://tradingeconomics.com/) and Investing.com (https://www.investing.com/).
6.	Conflicts of Interests
The authors declare that there are no conflicts of interests in this present article.
7.	References
Ahmad, W., Prakash, R., Salah Uddin, G., Chahal, R. J. K., Rahman, L., & Dutta, A. (2020). On the intraday dynamics of oil price and exchange rate: What can we learn from China and India? Energy Economics. Vol. 91.
Ali, S. R. M., Mensi, W., Anik, K. I., Rahman, M. & Kang, S. H. (2022). The impacts of COVID-19 crisis on spillovers between the oil and stock markets: Evidence from the largest oil importers and exporters. Economic Analysis and Policy. Vol. 73, pp. 345-372.
Baillie, R. T., Bollerslev, T., & Mikkelsen, H. O. (1996). Fractionally integrated generalized autoregressive conditional heteroscedasticity. Journal of econometrics, Vol. 74, No. 1, pp. 3-30.
Bourghelle, D., Jawadi, F., & Rozin, P. (2021). Oil price volatility in the context of Covid-19. International Economics. October 2021
Bollerslev, T. (1986). Generalized autoregressive conditional heteroscedasticity. Journal of Econometrics, Vol. 31, No. 3, pp. 307-327.
Bollerslev, T, & Hans, O. M. (1996). Modeling and pricing long memory in stock market volatility. Journal of Econometrics, Vol. 73, pp. 151–84.
Bordignon, S., Caporin, M., & Lisi, F. (2004). A seasonal fractionally integrated GARCH model. Working paper. University of Padova, Italy.
Cai, Y., Zhang, D., Chang, T. & Lee, C. (2022). Macroeconomic outcomes of OPEC and non-OPEC oil supply shocks in the euro area. Energy Economics, Vol. 109.
Chen, M. P., Lee, C. C., Lin, Y. H., & Chen, W. Y. (2018). Did the SARS pandemic weaken the integration of Asian stock markets? Evidence from smooth time-varying cointegration analysis. Economic research-Ekonomska istraživanja, Vol. 31, No. 1, pp. 908-926.
Chen, L., Wen, F., Li, W., Yin, H. & Zhao, L. (2022). Extreme risk spillover of the oil, exchange rate to Chinese stock market: Evidence from implied volatility indexes. Energy Economics. Vol. 107.
Conrad, C., and Haag, B. (2006). Inequality constraints in the fractionally integrated GARCH model. Journal of Financial Econometrics, Vol. 4, pp. 413-449.
Dacorogna, M. M., Ulrich, A. M., Robert, J. N., Richard, B. O., & Olivier, V. P. (1993). A geographical model for the daily and weekly seasonal volatility in the foreign exchange market. Journal of International Money and Finance, Vol. 12, pp. 413–38.
Dai, Z., Zhu, H. & Zhang, X. (2022). Dynamic spillover effects and portfolio strategies between Crude Oil, Gold and Chinese stock markets related to new energy vehicle. Energy Economics. Vol. 109.
Davidson, J. (2004). Moment and memory properties of linear conditional heteroskedasticity models, and a new model. Journal of Business and Economic Statistics, Vol. 22, pp. 16-190.
Ding, Z., Clive, W.J., Granger, & Robert, F. E. (1993). A long memory property of stock market returns and a new model. Journal of Empirical Finance, Vol. 1, pp. 83–106.
Elliott, G., Rothenberg, T. J., & Stock, J. H. (1996). Efficient Tests for an Autoregressive Unit Root, Econometrica, Vol. 64, No. 4, pp. 813-836.
Emrah Ismail Cevik & Sel Dibooglu & Atif Awad Abdallah & Eisa Abdulrahman Al-Eisa.(2021). Oil prices, stock market returns, and volatility spillovers: evidence from Saudi Arabia. International Economics and Economic Policy. Vol. 18, No. 1, pp. 157-175.
Engle, R. F. (1982). Autoregressive conditional heteroscedasticity with estimates of the variance of United Kingdom inflation. Econometrica: Journal of the econometric society, Vol. 32, pp. 987-1007.
Engle, R. F., & Bollerslev, T. (1986). Modelling the persistence of conditional variances. Econometric Reviews, Vol. 5, No. 1, pp. 1-50.
Foroni, C., Guerin, P., & Marcellino, M. (2017). Explaining the time-varying effects of oil market shocks on US stock returns. Economics Letters. Vol. 155 (Supplement C), pp. 84 - 88.
Granger, C. W.J., & Zhuanxin, D. (1996). Varieties of long memory models. Journal of Econometrics, Vol. 73, pp. 61–77.
Hashmi, S.M., Farhan, F., Zainab, A., & Syed, A. A. (2022). The impact of crude oil prices on Chinese stock markets and selected sectors: Evidence from the VAR-DCC-GARCH model. Environmental Science and Pollution Research.
Huang, S., An, H., Gao, X., Wen, S., & Hao, X. (2017). The multiscale impact of exchange rates on the oil-stock nexus: Evidence from China and Russia. Applied Energy. Vol. 194, pp. 667-678,
Jiang, M. & Kong, D. (2021). The impact of international crude oil prices on energy stock prices: Evidence from China. Energy Research Letters. Vol. 2, No. 4, pp. 28-33.
Li, C. S., and Xiao, Q. X. (2011). Structural break in persistence of European stock market: Evidence from panel GARCH model. International Journal of Intelligent Information Processing, Vol. 2, pp. 40-48.
Li, J., Liu, R., Yao, Y., & Xie, Q. (2022). Time-frequency volatility spillovers across the international crude oil market and Chinese major energy futures markets: Evidence from COVID-19. Resources Policy. Vol. 77.
Ma, R., Xiong, T., & Bao, Y. (2021). The Russia–Saudi Arabia oil price war during the COVID-19 pandemic. Energy Economics. Vol. 102.
Mensi, W., Al-Yahyaee, K. H., Vo, X. V. & Kang, S. H. (2021). Modeling the frequency dynamics of spillovers and connectedness between crude oil and MENA stock markets with portfolio implications. Economic Analysis and Policy. Vol. 71. pp. 397-419.
Meiyu, T., Li, W. & Wen, F. (2021). The dynamic impact of oil price shocks on the stock market and the USD/RMB exchange rate: Evidence from implied volatility indices. The North American Journal of Economics and Finance, Vol. 55.
Nasr, A. B., Boutahr, M., and Trabelsi, A. (2010). Fractionally integrated time varying GARCH model. Statistical Methods and Applications, Vol. 19, pp. 399-430.
Nguyen, T. N., Nguyen, D. T. & Nguyen, V. N. (2020). The Impacts of Oil Price and Exchange Rate on Vietnamese Stock Market. Journal of Asian Finance, Economics, and Business. Vol. 7. No. 8, pp. 143–150.
Perron, P. (1989). The great crash, the oil price shock, and the unit root hypothesis. Econometrica, Vol. 57, pp. 1361-1401.
Perron, P. (1997). Further evidence on breaking trend functions in macroeconomic variables. Journal of Econometrics, Vol. 80, pp. 355-385.
Rapach, D. E., and Strauss, J. K. (2008). Structural breaks and GARCH models of exchange rate volatility. Journal of Applied Econometrics, Vol. 23, pp. 65-90.
Ready, R. C. (2018). Oil prices and the stock market. Review of Finance. Vol. 22, No. 1, pp. 155 - 176.
Rohan, N., and Ramanathan, T. V. (2012). Asymmetric volatility models with structural breaks. Communications in Statistics-Simulations and Computations, Vol. 14, pp. 89-101.
Saraswat, G. B., Saraswat, M. & Tiwari, R. S. (2022). The Fluctuation in Interest Rate, Exchange Rate and Crude Oil Price and its impact on Stock Market. YMER, Vol. 21, No. 1.
Shabir, M. H, &Bisharat, H. C. (2022). Revisiting the relationship between oil prices, exchange rate, and stock prices: An application of quantile ARDL model, Resources Policy, Vol. 75, No. C.
Salah, A., Nusair & Olson, D. (2022). Dynamic relationship between exchange rates and stock prices for the G7 countries: A nonlinear ARDL approach. Journal of International Financial Markets, Institutions and Money, Vol. 78.
Tayefi, M., & Ramanathan, T. V. (2012). An overview of FIGARCH and related time series models. Austrian Journal of Statistics, 41(3), pp. 175-196.
Vochozka, M., Rowland, Z., Suler, P., & Marousek, J. (2020). The Influence of the International Price of Oil on the Value of the EUR/USD Exchange Rate. Journal of Competitiveness. Vol. 12, No. 2, pp. 167–190.
Wen, D., Liu, L., Ma, C. & Wang, Y. (2020). Extreme risk spillovers between crude oil prices and the U.S. exchange rate: Evidence from oil-exporting and oil-importing countries. Energy. Vol. 212.
Wen, F., Zhang, M., Xiao, J. & Yue, W. (2022). The impact of oil price shocks on the risk-return relation in the Chinese stock market. Finance Research Letters, Vol. 47 No. PB.
Yuan, D., Li, S., Li, R. & Zhang, F. (2022). Economic policy uncertainty, oil and stock markets in BRIC: Evidence from quantiles analysis. Energy Economics, Vol. 110, No. C.
Zhang, Z. & Qin, Y. (2022). Study on the nonlinear interactions among the international oil price, the RMB exchange rate and China's gold price. Resources Policy. Volume - 77.",Creative Commons Attribution (CC-BY),449,science,CH,en,"Bagchi,Bhaskar Bagchi,Biswajit Paul,Paul",https://pub.mdpi-res.com/img/journals/jrfm-logo-social.png?8600e93ff98dbf14,False,@MDPIOpenAccess,13.897133,39791379bf66aa2e35c9fbfd22ff5209
2,"Oil marketing companies stock jump as crude oil prices reduces, Check the details",Trade Brains,2023-03-16 00:00:00,date,https://in.investing.com/news/oil-marketing-companies-stock-jump-as-crude-oil-prices-reduces-check-the-details-3563411,investing.com,"Oil marketing companies stock jump as crude oil prices reduces, Check the details","Cooling crude oil prices sent the shares of major oil marketing companies (OMC) higher. Shares of state-run OMCs like Indian Oil (NS: IOC ), Bharat Petroleum (NS: BPCL ) and Hindustan Petroleum (NS: HPCL ) appreciated to the tune of 5%, a day after international crude oil prices used to their lowest levels recorded in more than a year. Brent crude and US WTI crude oil prices fell around 5% each to $73.7 per barrel and $67.6 per barrel respectively.

The fall in crude oil prices came amid concerns about the contagion in the world's financial system after the sudden collapse of the US-based Silicon Valley Bank (SVB). According to analysts, turmoil in major financial companies may send the world economy into a recession, affecting global demand. This may have led to a fall in prices.

Falling prices of crude oil are beneficial for India as it imports a major chunk of its requirement. Oil prices quoted at their lowest level in more than a year.

Analysts expect that declining crude oil prices could help in the improvement of marketing margins of OMCs. ICICI Securities (NS: ICCI ) said that according to their estimates, OMCs have a marketing margin of around ₹ 3 per litre on diesel, ₹ 6/per litre on Petrol and ₹ 4/litre on a blended basis.

Meanwhile, analysts at Prabhudas Lilldher believe that OMCs are all well placed to benefit from improving marketing situation and healthy refining profitability.

Shares of BPCL gained 6.02% and closed at ₹ 350.20 apiece, HPCL closed 6.53% higher at ₹ 245.40 apiece and Indian oil climbed 1.91% and closed at 80.10 apiece on Thursday.",investing.com,1372,business,ES,en,Trade Brains,https://i-invdn-com.investing.com/news/https://i-invdn-com.investing.com/akapi-images/800x450/bfd90e287a6c916de16ad465fe4c3d0f_w_800_h_450.jpg,False,,19.480265,ad0b70a0719433ab9c56ddd6a263c220
3,MCX Crude Oil Price Shows a V-Shaped Bounce,Kedia Advisory,2023-03-22 00:00:00,date,https://in.investing.com/news/mcx-crude-oil-price-shows-a-vshaped-bounce-3569789,investing.com,MCX Crude Oil Price Shows a V-Shaped Bounce,"MCX crude oil prices yesterday settled up by 5.71% at 5775 and managed to show a V-shape bounce amid improving risk sentiment thanks to the coordinated efforts by major central banks to rescue troubled U.S. and European banks. Yesterday's uptick in prices came after a historic deal in which UBS, Switzerland's largest bank, agreed to buy Credit Suisse (SIX: CSGN ) to save the bank. After an announcement of the agreement, major central banks, including the U.S. Federal Reserve and the European Central Bank, indicated that they would enhance market liquidity and support other banks.

Brent Crude prices continue to hold gains above $74.50 as yesterday Russia announced it would extend a unilateral 500,000 bpd production cut, first announced in February, through the end of June, potentially signalling a sustained production drop due to Western sanctions on its crude and oil products. While market participants are sceptical about whether Russia indeed reduced oil production last month, it cannot be ruled out that EU import bans and a G7 price cap have taken a bite out of the country's crude output. Moscow first announced a 500,000-bpd production cut on Feb. 10, after Deputy Prime Minister Alexander Novak warned there was a real risk the country would have to lower oil production this year due to the EU import bans and G7 price cap on its oil products. At the time, Novak said the cut would only last until the end of March. Today, Novak added that ""In accordance with the current market situation, the decision to voluntarily reduce production by the amount of 500,000 bpd will be valid until June 2023, inclusive.""

Officials with the G7, meanwhile, said the Group of Seven Nations was unlikely to revise a $60-per-barrel price cap on Russian oil as planned. The officials said EU countries' ambassadors were told over the weekend by the European Commission there was no pressing desire among the group for an immediate review. OPEC+, which includes the world's top oil exporting countries and allies, including Russia, is set to meet on April 3. The group agreed in October to cut oil production targets by 2 million barrels per day until the end of 2023.

Today traders are likely to exercise more caution ahead of the release of the highly anticipated rate decision from the Federal Open Market Committee, which concludes its two-day policy meeting today. As of now, according to CME's Fed Watch Tool, 83.4% of investors expect the Federal Reserve to lift interest rates by 25 basis points to just above 4.75% after today's meeting. That compares to just 16.6% of investors who believe the central bank will pause rate increases. Also, the American Petroleum Institute reports US commercial inventories of crude oil unexpectedly rose by 3.3 million barrels last week, a source citing the data says, while gasoline supplies fell by 1.1 million barrels. The results, which were bearish for crude, were released ahead of official EIA inventory data due tonight. Money managers cut their net long U.S. crude futures and options positions in the week of March 14, the U.S. Commodity Futures Trading Commission (CFTC) said on Tuesday. The speculator group cut its combined futures and options position in New York and London by 58,593 contracts to 104,431 during the period.",investing.com,1372,finance,ES,en,Kedia Advisory,https://i-invdn-com.investing.com/news/https://i-invdn-com.investing.com/akapi-images/800x450/deff89968d87efafc388aa45b5d36a11_w_800_h_450.jpg,False,,19.817736,baf1999b3b7e0f27028cc7b8bdf699d8
