,title,author,published_date,published_date_precision,link,clean_url,excerpt,summary,rights,rank,topic,country,language,authors,media,is_opinion,twitter_account,_score,_id
25,Higher Crude Oil Prices For Longer,MENAFN,2023-09-27 00:00:00,date,https://menafn.com/1107156242/Higher-Crude-Oil-Prices-For-Longer,menafn.com,"(Free Video) The 2 Secrets To Finding Small-Cap, Hidden Gem Stock Opportunities To Dramatically Grow Your Portfolio Going Into Q4.","(MENAFN- ValueWalk) (Free Video) The 2 Secrets To Finding Small-Cap, Hidden Gem Stock Opportunities To Dramatically Grow Your Portfolio Going Into Q4.





In his podcast addressing the markets today, Louis Navellier offered the following commentary.

ShowArtificially High YieldsCrude: Higher for LongerInvest in Hot SpotsCoffee Beans: Grazing on Weed Artificially High Yields

The financial markets seem convinced that there will be a federal government shutdown. The truth of the matter is these budget battles are a big game of chicken, so if the deficit ceiling is not lifted, a 30-day continuing resolution is the most likely scenario.

Even if there is a federal government shutdown, the interest payments on Treasury debt and Social Security payments are expected to continue since it would be political suicide to miss those payments. I anticipate that Treasury bond yields will finally moderate when the deficit ceiling is lifted, but in the meantime, the budget battles are contributing to artificially high Treasury yields.

Interestingly, if Congress does not pass a stopgap funding measure this weekend, such as a 30-day continuing resolution, essential workers like TSA, air traffic control and customs would stay on the job. However, the Commerce Department and Labor Department funding would dry up, so economic data would cease to be released. This would obviously interfere with the economic data that the Fed is monitoring.

In the past, similar partial federal government shutdowns have suspended funding for the federal courts, the FTC, the SEC and other federal agencies. Typically, these federal workers are reinstated within two weeks, with full backpay, so again the deficit ceiling is largely just political theater.

Crude: Higher for Longer

Multiple energy stocks are now reasserting their market leadership after gasoline prices in August rose 10.5% in the CPI and a whopping 20% in the PPI. This is due to an acute inventory decline. Furthermore, there is a diesel shortage again, especially in Europe, so the U.S. is exporting more distillates (i.e., diesel, heating oil, jet fuel, etc.), which is causing the trade deficit to decline and boost GDP growth. Naturally, since gasoline prices are high, Joe Biden's popularity is plunging in the polls. Saudi Arabia is controlling crude oil prices and appears to be striving to defeat President Biden.

Specifically, candidate Joe Biden said that he found'very little social redeeming value in the present government in Saudi Arabia' and promised that, as President, he would make the Saudi government an international'pariah.' Furthermore, if that was not insulting enough, candidate Biden then went on to insult the entire Saudi Royal Family.

So I think it is obvious that Saudi Arabia is keeping crude oil prices high to help defeat Joe Biden in the 2024 Presidential race. With $4 gasoline prices ($6 per gallon in California) and soon the be 4% unemployment from an 11-month manufacturing recession, it should not be surprising that Joe Biden is almost 10% behind candidate Donald Trump in a recent ABC News/Washington Post poll.

Do you know which under-the-radar stocks the top hedge funds and institutional investors are investing in right now? Click here to find out .

Due to food and energy inflation, consumers are not happy. The war against fossil fuels is failing, especially against natural gas, since in America, we are blessed to have the cheapest natural gas in the world. More pipeline projects are now reemerging as natural gas prices meander higher.

This is a good time to remind you that natural gas prices are very sensitive to the weather and ideally like hot miserable summers (for peaker power plants) and very cold winters (for heating). Last November, natural gas prices plunged 50%, due to a disruption at a big LNG port as well as unusually warm weather in the Northeast. This winter is forecasted to be much colder for both Europe and North America due to an El Nino weather pattern, which bodes well for higher natural gas prices.

Presidential election years are typically good for the stock market since the leading candidates promise everything and anything, which helps to boost consumer confidence. Joe Biden's reelection pitch is supposed to be launched in Super Bowl ads, while candidate Donald Trump clearly wants to restore lower gasoline prices, shore up the U.S. southern border, and end the war in Ukraine.

Powerful foreign influence from Saudi Arabia is expected to influence the 2024 Presidential election since they are effectively controlling gasoline prices. Russian Foreign Minister, Sergey Lavrov, wants to settle the Ukraine war on'the battlefield' due to waning support for Ukraine among NATO nations.

Russia is also being increasingly isolated and Foreign Minister, Sergey Lavrov, recently said'No matter what they say, they (the United States) control this (Ukraine) war' and added,'They supply weapons, ammunition, intelligence data, data from satellites, they are waging a war against us.'

All the money going to Ukraine has become a contentious issue, especially after Poland abruptly ceased all military aid to rebuild the Polish military readiness. I should add that Poland has been leading a ban on Ukrainian wheat to protect its farmers, so tensions between the two countries remain high. However, Poland may be increasingly worried that Russia will invade if Ukrainian defenses fail.

All this international chaos is expected to keep crude oil prices high. Furthermore, Joe Biden is going to have to defend spending billions to fund the war in Ukraine, while disaster relief in Maui and East Palestine, Ohio, is widely believed to be lacking. Since some Ukrainian generals have bought villas in Spain and are driving fancy sports cars, there is also a big concern that there are some serious leaks with the aid to Ukraine.

Invest in Hot Spots

Amidst this chaos, plus ongoing labor unrest in the U.S. with the UAW being the biggest of several strikes this year, American consumers remain grumpy, but continue to spend up a storm as their credit card bills grow to record levels. However, due to a strong U.S. dollar, the price of imported goods should continue to decline as falling EV prices have demonstrated, because the U.S. has been importing deflation from China.

As a result of a lot of chaos and distractions, our best defense remains a strong offense of fundamentally superior stocks. In addition to all the refinery and energy stocks, I am also recommending (1) the best AI stocks, (2) the drug companies profiting from the booming demand for weight loss medication, (3) the strong demand for cruising/travel demand, (4) a potato shortage, and (5) resurging semiconductor demand. In other words, stay invested in the best economic hot spots with improving sales and exploding earnings.

The earnings environment is poised to steadily improve in the next four quarters. There is no doubt that a strong U.S. dollar may hinder the earnings of some big multi-international companies since approximately half of the S&P 500's revenue is outside of America. The growth stocks I am recommending are not expected to be inversely impacted by a strong U.S. dollar. Furthermore, due to positive analyst earnings revisions in recent months, I am expecting another round of big earnings surprises! In other words, we remain'locked and loaded' for another earnings announcement season.

Coffee Beans: Grazing on Weed

A flock of sheep found their way into a greenhouse in Greece and ate more than 600 pounds of marijuana plants being cultivated for medical use. Source: UPI. See the full story here .

(Free Video) The 2 Secrets To Finding Small-Cap, Hidden Gem Stock Opportunities To Dramatically Grow Your Portfolio Going Into Q4 .",menafn.com,6165,news,US,en,MENAFN,https://menafn.com/updates/pr/2023-09/27/V_070a3image_story.jpeg,False,@menafn,22.616798,77dd26aa92cfef355561c4c82fcf20ed
26,Crude oil prices decline to $85 a barrel on demand fall,Express News Service,2023-10-06 00:00:00,date,https://www.newindianexpress.com/business/2023/oct/06/crude-oil-prices-decline-to-85-a-barrel-on-demand-fall-2621317.html,newindianexpress.com,Petroleum and Natural Gas minister Hardeep Singh Puri on Wednesday said rising crude oil prices could create organised chaos and devastation in several parts of the world.,"NEW DELHI:  Crude prices in the international market fell for the second consecutive day on Thursday as weak demand for gasoline from the US. Brent Crude Future on October 5, 2023, was trading at $85.45 a barrel while the US WTI was trading at $84.38 a barrel at 8.11 pm IST. This is nearly 12% below its last week high of $97 a barrel.  Oil price witnessed its biggest one-day drop of more than $5 on Wednesday in over a year.  The decline is also attributed to the reports that Russia might soon lift its ban on diesel exports. 
 
However, Russia and Saudi Arabia are continuing to maintain their voluntary oil production cuts. As per the OPEC+ ministerial panel, Saudi Arabia would continue with a voluntary cut of 1 million barrels per day (bpd) until the end of 2023, while Russia would keep a 300,000 bpd export curb until the end of December.  Crude oil prices have been trading above $90 per barrel in recent weeks. 
 
Petroleum and Natural Gas minister Hardeep Singh Puri on Wednesday said rising crude oil prices could create organised chaos and devastation in several parts of the world. The minister, in an interview with a news channel at the ADIPEC oil and gas conference in Abu Dhabi, said the price of $100 a barrel is not in the interest of either the producing countries or the consumers. 
 
The ministermet OPEC Secretary General Haitham Al-Ghais and urged him to use his office to imbue a sense of pragmatism, balance, and affordability in the oil markets. The minister said that the prices of around $80 per barrel or slightly less than that would be a convenient price range for countries. 'If the price goes above $100, it is not going to be in the interest of either the producing country or anyone's interest. You will have large, organised chaos,' he said in an interview to a news channel.



NEW DELHI:  Crude prices in the international market fell for the second consecutive day on Thursday as weak demand for gasoline from the US. Brent Crude Future on October 5, 2023, was trading at $85.45 a barrel while the US WTI was trading at $84.38 a barrel at 8.11 pm IST. This is nearly 12% below its last week high of $97 a barrel.  Oil price witnessed its biggest one-day drop of more than $5 on Wednesday in over a year.  The decline is also attributed to the reports that Russia might soon lift its ban on diesel exports. 

However, Russia and Saudi Arabia are continuing to maintain their voluntary oil production cuts. As per the OPEC+ ministerial panel, Saudi Arabia would continue with a voluntary cut of 1 million barrels per day (bpd) until the end of 2023, while Russia would keep a 300,000 bpd export curb until the end of December.  Crude oil prices have been trading above $90 per barrel in recent weeks. 

Petroleum and Natural Gas minister Hardeep Singh Puri on Wednesday said rising crude oil prices could create organised chaos and devastation in several parts of the world. The minister, in an interview with a news channel at the ADIPEC oil and gas conference in Abu Dhabi, said the price of $100 a barrel is not in the interest of either the producing countries or the consumers. googletag.cmd.push(function() {googletag.display('div-gpt-ad-8052921-2'); });

The ministermet OPEC Secretary General Haitham Al-Ghais and urged him to use his office to imbue a sense of pragmatism, balance, and affordability in the oil markets. The minister said that the prices of around $80 per barrel or slightly less than that would be a convenient price range for countries. 'If the price goes above $100, it is not going to be in the interest of either the producing country or anyone's interest. You will have large, organised chaos,' he said in an interview to a news channel.",newindianexpress.com,3045,business,IN,en,Express News Service,https://images.newindianexpress.com/uploads/user/imagelibrary/2023/10/6/w600X390/Crude_oil_.jpg,False,NewIndianXpress,19.650629,479bf771e97f025207dbe0c52c984c58
27,Oil Minister Hardeep Singh Puri Calls Upon OPEC To Make Crude Prices Affordable,MENAFN,2023-10-04 00:00:00,date,https://menafn.com/1107186043/Oil-Minister-Hardeep-Singh-Puri-Calls-Upon-OPEC-To-Make-Crude-Prices-Affordable,menafn.com,"Oil Minister Hardeep Singh Puri Calls Upon OPEC To Make Crude Prices Affordable New Delhi, Oct 4 (KNN) India's Petroleum Mini","(MENAFN- KNN India) Oil Minister Hardeep Singh Puri Calls Upon OPEC To Make Crude Prices Affordable

New Delhi, Oct 4 (KNN) India's Petroleum Minister Hardeep Singh Puri on Tuesday urged oil producers' cartel OPEC (Organization of the Petroleum Exporting Countries) to'imbue a sense of pragmatism, balance and affordability in the oil markets'.

He highlighted the rise in crude oil prices due to production cuts by major oil producers and its expressed concerns over its adverse impact on major oil consuming nations.







According to an official statement, he held talks with OPEC Secretary General Haitham Al-Ghais in Abu Dhabi and called for'balancing global energy markets by ensuring that crude oil prices do not outstrip the paying ability of the consuming countries'.

India is the world's third-largest consumer of crude oil and depends on imports to meet over 85% of its requirement.

He has also been cautioning that unreasonably high oil prices could jeopardise the post-pandemic recovery and lead to an economic slowdown in various parts of the world, which could in turn hit global oil demand.

'During the discussions, the minister highlighted that due to the production cuts carried out by OPEC and OPEC+ countries from August 2022 onwards, effectively around 5% of the total global oil availability has been removed from the market, causing crude oil price to rise around 34% in just (the) last 3 months. These cuts have been made despite growing energy demand. Brent Crude oil prices jumped from around $72/bbl in June to around $97/bbl in September 2023, placing severe strains on the capacities of most oil importing consuming countries,' the petroleum ministry said in the statement.

'Minister wondered whether the global economy is again going to witness a situation similar to the economic turmoil of 2008 which had become a self-fulfilling prophecy. Brent prices had initially soared from $93.60/bbl in January 2008 to $ 134.3/bbl in July 2008, fueling an accelerated global economic meltdown, leading eventually to demand destruction and very low oil prices,' it added.

(KNN Bureau)",menafn.com,6165,news,US,en,MENAFN,https://menafn.com/updates/pr/2023-10/04/KI_92fafimage_story.jpg,False,@menafn,16.7058,437ee787436ee9c8c2bda09cb1e2f89f
28,Check inflation as Gaza war pushes up crude oil prices,,2023-10-11 00:00:00,date,https://www.newindianexpress.com/opinions/editorials/2023/oct/11/check-inflation-as-gaza-war-pushes-up-crude-oil-prices-2622680.html,newindianexpress.com,"Iran, a major oil producer, had been pumping more oil after the US began easing sanctions on Tehran.","The Ukraine War, into its second year now, has burdened the world with energy and food shortages, and volatile oil prices. But suddenly there is a new war on and we have a new crisis to grapple with. The flashpoint is the Gaza Strip for now, but the fighting may spread. Even as the Israelis and Palestinians come to terms with the horrific death toll, the reverberations on the world economy can be felt loud and clear. Crude oil prices surged sharply on Monday as fighting intensified in and around Gaza. Brent crude rose 3.44 percent to $87.49 a barrel, while US West Texas intermediate crude rallied 3.85 percent to $85.98. The upward trajectory for oil, which had eased by $5-6 a barrel in recent days, is likely to continue as there is perception of a shortage looming.
 
Iran, a major oil producer, had been pumping more oil after the US began easing sanctions on Tehran. However, Iran's public backing of the Hamas attacks may push the US to turn the screws once again, resulting in a supply cut. A bigger fear is that if Iran is drawn into the conflict it could disrupt seaborne oil supplies through the Strait of Hormuz; about 37 percent of seaborne oil passes through the narrow waterway off Iran's southern border. For India, which imports 85 percent of its needs, crude oil prices rising to $100 or beyond will have serious implications. Inflation has just about been brought under control; if oil prices rise we run the risk of getting hurt again.
 
Another significant casualty is going to be the India-Middle East-Europe economic corridor. The transport and communication corridor running from India to Europe through Saudi Arabia was aimed at countering China's Belt and Road Initiative. However, with the Middle East under war clouds, it will be some time before the multi-nation bonhomie can be resumed. Though insignificant, India's trade with Israel may be hit too. What is significant though is that India is a major importer of Israeli security technology. Given the failure of Tel Aviv's vaunted security system in detecting the Hamas attack, perhaps our government may want to order a review. Despite the coming crude price rise, the major task at hand for the government is to keep retail oil prices in check and ensure that inflation does not surge.
 
 



The Ukraine War, into its second year now, has burdened the world with energy and food shortages, and volatile oil prices. But suddenly there is a new war on and we have a new crisis to grapple with. The flashpoint is the Gaza Strip for now, but the fighting may spread. Even as the Israelis and Palestinians come to terms with the horrific death toll, the reverberations on the world economy can be felt loud and clear. Crude oil prices surged sharply on Monday as fighting intensified in and around Gaza. Brent crude rose 3.44 percent to $87.49 a barrel, while US West Texas intermediate crude rallied 3.85 percent to $85.98. The upward trajectory for oil, which had eased by $5-6 a barrel in recent days, is likely to continue as there is perception of a shortage looming.

Iran, a major oil producer, had been pumping more oil after the US began easing sanctions on Tehran. However, Iran's public backing of the Hamas attacks may push the US to turn the screws once again, resulting in a supply cut. A bigger fear is that if Iran is drawn into the conflict it could disrupt seaborne oil supplies through the Strait of Hormuz; about 37 percent of seaborne oil passes through the narrow waterway off Iran's southern border. For India, which imports 85 percent of its needs, crude oil prices rising to $100 or beyond will have serious implications. Inflation has just about been brought under control; if oil prices rise we run the risk of getting hurt again.

Another significant casualty is going to be the India-Middle East-Europe economic corridor. The transport and communication corridor running from India to Europe through Saudi Arabia was aimed at countering China's Belt and Road Initiative. However, with the Middle East under war clouds, it will be some time before the multi-nation bonhomie can be resumed. Though insignificant, India's trade with Israel may be hit too. What is significant though is that India is a major importer of Israeli security technology. Given the failure of Tel Aviv's vaunted security system in detecting the Hamas attack, perhaps our government may want to order a review. Despite the coming crude price rise, the major task at hand for the government is to keep retail oil prices in check and ensure that inflation does not surge.googletag.cmd.push(function() {googletag.display('div-gpt-ad-8052921-2'); });",newindianexpress.com,3045,news,IN,en,,https://images.newindianexpress.com/uploads/user/imagelibrary/2023/10/11/w600X390/Banking_crisis_.jpg,True,NewIndianXpress,18.907919,45132ce324400ab0c3a990069cec9231
29,Crude Oil Prices Might Have Ran Too Far In Q3 Amid A Deteriorating China Outlook,MENAFN,2023-10-11 00:00:00,date,https://menafn.com/1107225918/Crude-Oil-Prices-Might-Have-Ran-Too-Far-In-Q3-Amid-A-Deteriorating-China-Outlook,menafn.com,ces Might Have Ran Too Far in Q3 Amid a Deteriorating China Outlook,"(MENAFN- DailyFX) ces Might Have Ran Too Far in Q3 Amid a Deteriorating China Outlook Skip to Conten News & Analysis at your fingertips. We use a range of cookies to give you the best possible browsing experience. By continuing to use this website, you agree to our use of cookies.

You can learn more about our cookie policy here , or by following the link at the bottom of any page on our site. See our updated Privacy Policy here .

English

日本語

中文(繁體) 中文(简体) Free Trading Guides Subscribe Please try again Free Trading Guides Subscribe to Our Newsletter Please try again





Market Overview



Real-time News







Market Themes



EUR/USD News



Gold News

Oil - US Crude News Recent Market News Headlines Free Guide





Technical Analysis



Analyst Picks



Forecasts



Market Outlook

DailyFX TV Recent Trading Strategies Headlines Free Guide





EUR/USD



GBP/USD



AUD/USD



USD/JPY



All currencies

Major currency pairs Recent Currencies Headlines





Oil - US Crude



Gold



Silver



Natural Gas



All commodities

Major commodities Recent Commodities Headlines





Wall Street



US 500



US Tech 100



FTSE 100



All stocks

Major stock indices Recent Stocks Headlines





Bitcoin



Ethereum



Litecoin



All cryptocurrencies

Major cryptocurrencies Recent Cryptocurrencies Headlines





Rates



Earnings Calendar



Sentiment



DNA FX







Live Chart



Support & Resistance

View All Tools Free Guide Trading Tools  Search Search results No entries matching your query were found.",menafn.com,6165,news,US,en,MENAFN,https://menafn.com/updates/pr/2023-10/11/D_d3fe6image_story.JPG,False,@menafn,16.066635,52d54e4f27bee327166554528752ecc0
30,Oil Price Outlook: Crude Spiked After Iran Calls For Embargo On Israel,MENAFN,2023-10-21 00:00:00,date,https://menafn.com/1107279326/Oil-Price-Outlook-Crude-Spiked-After-Iran-Calls-For-Embargo-On-Israel,menafn.com,look: Crude Spiked after Iran Calls for Embargo on Israel,"(MENAFN- DailyFX) look: Crude Spiked after Iran Calls for Embargo on Israel Skip to Conten News & Analysis at your fingertips. We use a range of cookies to give you the best possible browsing experience. By continuing to use this website, you agree to our use of cookies.

You can learn more about our cookie policy here , or by following the link at the bottom of any page on our site. See our updated Privacy Policy here .

English

日本語

中文(繁體) 中文(简体) Free Trading Guides Subscribe Please try again Free Trading Guides Subscribe to Our Newsletter Please try again





Market Overview



Real-time News







Market Themes



EUR/USD News



Gold News

Oil - US Crude News Recent Market News Headlines Free Guide





Technical Analysis



Analyst Picks



Forecasts



Market Outlook

DailyFX TV Recent Trading Strategies Headlines Free Guide





EUR/USD



GBP/USD



AUD/USD



USD/JPY



All currencies

Major currency pairs Recent Currencies Headlines





Oil - US Crude



Gold



Silver



Natural Gas



All commodities

Major commodities Recent Commodities Headlines





Wall Street



US 500



US Tech 100



FTSE 100



All stocks

Major stock indices Recent Stocks Headlines





Bitcoin



Ethereum



Litecoin



All cryptocurrencies

Major cryptocurrencies Recent Cryptocurrencies Headlines





Rates



Earnings Calendar



Sentiment



DNA FX







Live Chart



Support & Resistance

View All Tools Free Guide Trading Tools  Search Search results No entries matching your query were found.",menafn.com,6165,news,US,en,MENAFN,https://menafn.com/updates/pr/2023-10/21/D_e919aimage_story.png,False,@menafn,18.080872,d84f674407c0defcd81dd5b98812cbf2
